headline,word1,word2,joke,label
守时无法分享引发社会热议,拥有,守时,守时是一种东西，如果你拥有它，通常没有人可以与你分享。,1
德国人姓魏引热议,为什么,姓魏,德友人魏特茂，娶了中国太太。某日遇一老翁，两人寒暄起来。 老翁：您贵姓？ 德佬：我姓魏。 老翁：魏什么？ 德佬：为什么？姓魏也要为什么？,1
男子街头躲进酒吧引发热议,躲,酒吧,两名男子走在街上。一个人走进酒吧......聪明的人躲了起来！,1
医生建议运动减肥，患者吐槽妻子说话多却下垂,说个,下巴,医生：消除你多余脂肪的惟一方法便是运动尽量地运动。 甲：胡说！我太太每天都说个不停，可是她的下巴却一直是两层的。,1
教师改姓引发学生晕倒,改,姓,一名教师来到班里对同学们说：我姓李，以后你们就叫我王老师好了！ 全班晕倒一大片……,1
放射性猫引发科学争议,变得,半衰期,如果一只猫变得具有放射性，它现在会有18个半衰期吗？,1
人们宁愿死也不愿思考,宁愿,思考,大多数人宁愿死也不愿意思考; 事实上，他们这样做了。,1
代表重要性决定人生走向,确保,代表,确保你代表什么，否则你可能会因任何事情而堕落。,0
孩子被称傻引发热议,说,傻,傻孩子，怎么会有人说你傻呢？,1
男子被孩子追问电话号码原因,拿起,电话,米勒先生的电话铃想起，他去接听。 一个小孩的声音在电话的另一头问：你的号码是不是694136？ 不是。米勒先生回答。 那你为什么拿起电话听筒？孩子问。,1
邻居投诉乱扔脏物，住户笑称要洗净再扔,扔,脏物,楼下邻居投诉我乱扔脏东西，真是搞笑，难道我要洗干净再扔吗？,1
水至清则无鱼：社会极端清廉反而无人追随,至,鱼,水至清则无鱼，人至贱则无敌！,1
简化方式一到十二,简化,方式,更简单，更柔和的方式是一到十二。,0
有人故意传播废话被质疑,传播,废话,这些人是愚蠢的，还是故意传播他们的废话？,0
门卫互换值班引笑料,拉,肚子,张三和李四都是门卫，中午张三来值班，换李四吃饭。 张三突然说：你先等等，我要拉肚子！ 李四答：那你快去拉，拉完了我好去吃。,1
癞蛤蟆称雌者最美,称,雌蛤蟆,你问雄癞蛤蟆什么最美，他的回答一定是雌癞蛤蟆。不用怀疑他的欣赏水平，只是所处的环境不同。,1
引领与跟随走出困境,走出,困境,无论是领导还是跟随，或者让他们走出困境。,0
与自己结盟成为新希望,结盟,自己,由于未能征服自己，现在最好的希望是与自己结盟。,0
人生如打电话，谁先挂谁输,挂,电话,人生就像打电话，不是你先挂，就是我先挂。,1
记忆被遗忘的诡异现象,放,脑海,把它放在你的脑海里。很快，它将成为一个被遗忘的记忆。,1
网友分享不开心事引发共鸣,说出来,开心,你有什么不开心的事? 说出来让大家开心一下.,1
阳光下行走无法抵达目的地,行走,阳光,仅在阳光明媚的日子行走是永远不会到达目的地。,0
网友半夜上网狂嗨后失眠服安眠药,上网,安眠药,半夜上网，去歌厅、舞厅，困了不睡觉。之后失眠，再吃安眠药。,1
沃尔玛降价却无免费商品,降价,免费,如果沃尔玛每天都在降价，那么为什么没有什么是免费的呢？,1
狗主引领生命远离家具,引领,家具,你一直在引领着狗的生命。远离家具。,1
解放军匍匐前进被比作绿色青虫,匍匐,青虫,解放军叔叔一个个匍匐前进，就像一条条绿色的青虫在地上蠕动。,1
弟弟把花盆当牙签用,当,牙签,我问，之前那盆呢？ 阿姨幽幽的说：被你弟当牙签用完了。,1
每个行动都有相反批评,批评,行动,哈里森的假设：对于每一个行动都有一个平等和相反的批评。,0
三名男子来自全球不同地区,来自,地区,有来自世界不同地区的3名男子。,0
兄弟跑赢妹妹化解勒索危机,跑得,你,妹妹：哥，如果有不良少年勒索我们，怎么办？ 小新：跑呀！ 妹妹：你跑得赢他们吗？ 小新：我只要跑得赢你就行了,1
食物为何普遍使用塑料包装,使用,塑料,为什么这么多食物都用塑料包装？这太不可思议了。,0
美女邀约却无人应门,敲门,家里,有个美女给我发短信，说：今晚来我家吧，我家没人。 于是我去敲门，敲了一小时，果然没人。,1
鹦鹉模仿被诉侵权,模仿,原声,鹦鹉：非法模仿，混淆原声，被告侵权。,1
单音节词是否应更短,应该,单音节,“单音节”不应该有一个较短的单词吗？,0
会计师不懂价值只知成本,知道,价值,会计师：他们知道所有东西的成本，却不知道这些东西的价值。,1
鹿穿越黄色路标引热议,穿过,路标,他们如何让鹿在黄色路标上穿过？,1
雨夜结拜兄弟引热议,结拜,兄弟,小时候的一个雨夜，哥哥和弟弟在床上聊天，越聊越亲，我俩感觉应该更亲近一些，然后我俩就结拜成把兄弟了……,1
猪成胖人代名词引热议,成为,猪,猪是一种动物，但是它也是胖人的代名词！,1
对话被括号屏蔽，真相藏在括号里,听不到,括号,如果你听不到我的话，那是因为我在括号里。,1
受骗与学历职业无关,上当,教育,上当受骗与受教育程度和职业没有直接的联系。,1
审查员自曝知识超预期,知道,人,审查员 - 一个比他认为你应该知道更多的人。,1
幼儿园男孩拒女帮搭积木,拒绝,积木,幼儿园里，有个小男孩在搭积木，总是不成功，旁边有个小女孩友好的说：“我来帮你吧。” 小男孩听后一脸不屑的转过头说：“去！男人的事情女人不要管。”,1
网友吐槽被误解为荡秋千,上吊,荡秋千,哥难过的都要上吊了，你还以为哥在荡秋千。,1
运动会喊口号变味成糖醋萝卜,喊,萝卜,学校开运动会，老师临时通知喊口号团结紧张，严肃活泼。 体育委员口吃，阅队是集体喊成团结紧张，糖醋罗卜。,1
丈夫记反规则被妻子怒斥,记反,两瓶,深夜两点，醉醺醺的丈夫才回家。 妻子怒：我一再告诉你，喝酒不能超过两瓶，回家不能超过十点，你敢不听我的？！ 丈夫：我记反了。,1
男友为烟花浇水惹笑，情人节浪漫变荒诞,浇水,烟花,情人节买了好多烟花， 为了让女朋友看到绽放的美丽， 我每天都坚持给烟花浇水。,1
法语单词揭秘自助餐的真实含义,动手,早餐,自助餐。一个法语单词，意思是：起床并自己动手！,1
家长唱摇篮曲被邻居劝让孩子哭,唱,孩子,凌晨，宝宝醒了一直哭，搞的我们都睡不着。老婆让我唱摇篮曲先哄孩子睡着，无耐，只能唱了。 过了不久，邻居过来了，说了句，你还是让他哭吧。,1
警惕虚假信息,阅读,内容,如果您相信您阅读的所有内容，请不要阅读。,0
手机握持影响驾驶表现,开,手机,如果你把手机放在你的手上，你觉得你可以开得更好吗？,0
咖啡巧克力揭示男性财富新趋势,揭示,财富,咖啡，巧克力，男人......有些东西更富有。,0
贪吃被指过分引发热议,贪吃,界限,贪吃没什么不对，只要你不过分。,1
南方乡村幽默网站上线,欢迎,网站,欢迎来到南方最好的'乡村幽默'网站！,0
人徘徊于牛A与牛C之间,徘徊,牛C,做人就要做一个徘徊在牛A和牛C之间的人。,1
伪君子颠倒黑白的真相,说成,灰的,胆小的伪君子把白说成灰的；胆大的伪君子把黑的说成灰的。颠倒黑白最成功的不是颠倒黑白，而是没有黑白。,1
数据驱动阅读新体验,给,阅读,数据，给我一个阅读。它似乎是一个标语。,0
幸福女人传记成最薄书籍,成为,传记,什么是世界上最薄的书？幸福女人的传记。,1
结婚三天夫妻爆发冲突,打了,忍耐,女：为什么结婚前你对我百依百顺，可结婚才三天，你竟跟我打了两天半的架。 男：因为我的忍耐是有限度的。,1
微软成问题而非答案,不是,答案,微软不是答案。微软是个问题。'不'就是答案。,0
信件中的舌头用途引人遐想,做些什么,一封信,如果你写了一封信，也许你会用舌头做些什么？,0
名花有主仍移花接木,移,花,即使你已经名花有主，我也要试着移花接木。,1
论证显示两人在场,证明,在场,在大多数情况下，所有论证都证明有两个人在场。,0
孩子行为颠覆遗传观念,相信,傻瓜,每个人都相信遗传，直到他们的孩子像傻瓜一样行事。,1
预言家自尽未遂引热议,预言,自尽,一个外国预言家还是哲学家，预言自己到了未来某一天会死，结果到了那一天还没动静，他自尽了。,1
情侣互爱引发荒诞事件,挂在,巴尼,我爱你，你爱我，让我把巴尼挂在树上。,0
学生画天坛被误认成生日蛋糕,夸,蛋糕,妈妈带儿子到天坛游园，回来之后正在学绘画的他，就把天坛画了出来交给了老师。 结果老师在课上连连夸道：“小明同学画的生日蛋糕真不错，我贴出来大家好好欣赏欣赏。”,1
截止日期临近，剩余工作加速完成,完成,工作,随着截止日期的临近，为了达到目标而完成的剩余工作也会增加。,0
自负者陷入车辙困境,陷入,车辙,一个自负的人认为，当他真的处于一个车辙时，他正陷入困境。,0
邻居借盐被调侃舔盐,要求,盐,我去了邻居家，并要求借一杯盐。“你在做什么？” “盐舔。”,0
课堂上学生反问：宽恕前应先犯罪,应该,犯罪,宗教课上，女教师问小学生：孩子们，现在谁能告诉我，在我们预计会得到宽恕之前，我们应该干什么？ 一个学生站起来说：我们首先应该犯罪。,1
牙签误喊公交停运,喊,公交车,"一天，一牙签和女朋友在路上散步，看见一刺猥。 连忙说了句：“公交车,停一下!” 刺猥说：“对不起，车上乘客满了，你们坐下一趟吧。”",1
中文中危机与机会表述相同,解读,机会,在中文里，为什么危机和机会的话语是一样的？,0
家人聆听专家意见,聆听,意见,病人的家人聚集在一起听取专家们的意见。,0
艰难中寻求进展,寻求,进展,当事情变得艰难时，艰难的进展。,0
以色列唯一鸡成汤料引热议,成为,鸡,关于以色列唯一的鸡是他们的汤。,1
死亡后是否还会累？网友热议,死了,累,人都死了应该不会累吧，没死过不知道，一个猜想不一定对。,1
用户购买班卓琴无附加条件,购买,班卓琴,我买了班卓琴，没有任何附加条件。或者：我买了一个网球拍，没有任何附加条件。,0
自称世界最大权威,自称,权威,根据我自己的看法，我是世界上最大的权威。,0
雅典集会因身份错位沦为暴民,成为,暴民,如果每个雅典娜公民都是苏格拉底人，那么每个雅典集会都会成为暴民。,1
邻居竟知晓我姓氏引热议,知道,姓氏,和对面那户人家住在一个单元十几年了，昨天发现，他居然知道我姓什么。,1
马驴对话揭生活困境,拉磨,飘零,马对驴说：“别以为找了个家就了不起，还不是个拉磨的？” 驴对马说：“风里来雨里去独自飘零，你说活着有啥意思？”,1
硬件人员会照顾简单任务,照顾,硬件,如果它很容易，硬件人员会照顾它。,0
取悦所有人反成众叛亲离,取悦,所有人,如果你试图取悦所有人，没有人会喜欢它。,1
男人让女人高兴却引发悲惨事件,让,女人,当我能让很多女人高兴的时候，为什么我会让一个女人如此悲惨？,1
灵魂书写永恒不灭,写下,灵魂,墨水干涸，纸张烧伤，但灵魂中写下的东西将持续永恒。,0
为爱付出却遭索财,付出,生命,他：为了你，我可以付出我的生命。 她：亲爱的，在你死之前请把你的钱全部给我。,1
前妻相亲成灾难,相亲,前妻,你知道，与你的前妻相亲是一个糟糕的日子。,1
年轻人夸大 老人假装,夸大,假装,年轻人可能会夸大其词，但老人们假装。,1
光明后为何称天黑后,称,天黑,当它真的是“光明之后”时，为什么称它为“天黑以后”？,1
情人过情人节，敌人过清明节,过,节日,有情人的过情人节，有敌人的过清明节。,1
别人看衣领，妻子看口袋,关注,口袋,上衣是否干净，别人关注的是衣领，妻子却关注口袋。,1
学生要求新科目认知,要求,科目,学生要求这些，并吞下它们，并对这些科目有新的认识。,0
餐厅肉卷暗藏玄机，顾客被警告不要食用,不要,肉卷,阿呆来到餐厅：给我一份肉卷、一些面包和一句好话。 服务生送来肉卷和面包时，阿呆问：我要的好话呢？ 服务生低声道：不要吃这份肉卷！,1
拍照变丑？真相是像素变高了,变,像素,向同事倾诉，我以前拍照挺好看的，现在怎么越拍越丑了啊？ 同事淡淡地说：现在的像素越来越高了。,1
新婚夫妇亲嘴被孩子误听成比嘴大小,比,嘴,一天晚上，有一对新婚夫在亲嘴被6岁小舅子看到了，小舅子不知是怎么回事，就跑着去问他娘：姐姐和姐夫他们在干什么？ 他娘就说：他们在比谁的嘴更大！,1
早逝者愿清晨停止心跳以省上班时间,停止,心跳,如果我英年早逝，我更愿意在早上停止心跳，因为这样就少上一天班。,1
枪决变掐死：哑弹三次犯人求活,掐死,哑弹,一人被执行枪决。 第一枪哑弹，第一枪哑弹，第三枪还是哑弹。 犯人哆嗦地抓着刑警的裤腿说：“大哥，你行行好，掐死我吧！太吓人了！”,1
老农见天安门大失所望：不发光是假货,看见,天安门,一老农向往北京天an门久矣，但只在宣传画上见过。n年后，终有缘一见，却大失所望：假货！怎么不发光呢？,1
孙悟空周末不上班引祖孙对话,听到,上班,某天走路上，听到一对祖孙对话。 孙子：奶奶，为什么这两天没有演西游记了。 奶奶：今天周六啊，孙悟空周末不上班。 孙子听后，若有所思的点了点头。,1
学生镜中喊兽类回应,照,哞,很多年前的了。 一同学摆弄小镜子，我前去观望。 那哥们兀地把镜子举过头顶，对我照下来：孽畜，还不速现原形。 我脑残的回了句：哞。,1
顾客误认云计算为天象现象,掏出,云计算,顾客大为惊讶，纷纷掏出计算器验证，皆无误，也抬头望天，惊恐地问：“这就是云计算？”,1
她否认优柔寡断,否认,优柔,我不是......不，我......不，我不是。你觉得我优柔寡断吗？,0
上帝在看我们，只能娱乐,娱乐,上帝,如果上帝在看着我们，我们至少可以做的就是娱乐。,1
穿过狗群险被撕伤,穿过,手臂,当你穿过牧羊犬和比特犬时你会得到什么？一条撕开你手臂的狗然后去寻求帮助！,1
男子喂狗饼干,喂,饼干,所以那个男人从口袋里掏出一些饼干喂给狗。,0
代码与评论不一致可能均存错误,发现,错误,如果代码和评论不一致，两者都可能是错误的。,0
蜜月竟是约会与辩论的中间状态,徘徊,蜜月,蜜月是约会和辩论之间短暂的徘徊。,1
父亲问女儿如何听话，女儿反问：您都不知道？,知道,听话,女儿调皮，气得我不行。实在是没办法了，我问她：“你要我怎样你才听话？” 她居然想都不想，就说：“您都不知道，我怎么知道？”,1
美式选举奇葩对比：总统仅两人选，小姐却有五十,选择,总统,为什么美国人只选择两个人竞选总统，50个选择美国小姐？,1
薪水存银行却嫌太少,拿到,薪水,我必须把薪水拿到银行。它本身太少了。,1
孔子建议闭嘴避免显得愚蠢,闭嘴,愚蠢,孔子说：最好闭嘴，看起来愚蠢而不是张开嘴，消除所有怀疑。,1
老人自称已90岁惊呆医生,喊,健康,一个老头去看病，大夫详细地检查老头的身体后说：亲爱的，你真健康，你可以活到90岁！ 我已经90岁了！老头大喊。 您瞧，我给你算得多准！,1
读鲁迅却做鲁迅笔下之人,做,人,好多人读着鲁迅，却做着鲁迅笔下的人。,1
经理称保险柜已彻底检查无物,检查,保险柜,警察：保险柜检查没有？ 经理：已经彻底检查过了，他没有在里面。,1
没时间时如何放松,放松,时间,花时间放松，特别是当你没有时间的时候。,1
投资需用蜡笔画清思路,投资,想法,永远不要投资任何你无法用蜡笔说明的想法。,1
网友爆料老大将无法线下见面只能下载,下载,老大,一哥们突然爆出句惊人之语： 老大以后再见到你，估计只能下载啦！,1
学生作文对比引发幽默回答,觉得,作文,小学语文课上，老师问一女生：你觉得是你的作文写得好还是他的好呢？ 小女孩答到：他好，我也好。,1
守密者获更多秘密,守住,秘密,只有守得住秘密的人才能得到更多的秘密。,1
房价飙升导致好男人减少,越来越高,好男人,房价越来越高，所以，好男人越来越少。,1
奇葩车牌引怒车主,说道,车牌,今天和BF逛街，在路上看到一辆车，车牌是488L8，我顺口说道，你瞧这倒霉车牌，“死爸爸了吧”。 说完发现车主坐在车里怒视着我，赶快撒腿就跑。,1
孩子误以为电话是小洞,哭,小洞,一个小女孩第一次在电话里听到她父亲的声音时，便大声哭了起来，她母亲问道：孩子，怎么啦？ 妈妈，小女孩哭道，我们怎样才能把爸爸从这样的小洞眼里救出来呢？,1
专辑深夜教学引发口吃尴尬,记录,西班牙语,我买了一张专辑，在你睡觉的时候教你西班牙语。在夜间记录跳过，所以现在我只能用西班牙语口吃。,1
宇宙目标低下引热议,说,目标,如果我们的物种在宇宙中是独一无二的，那么我不得不说宇宙的目标相当低而且很少稳定。,1
花前月下不如花钱日下,花钱,日下,花前月下 不如花钱日下。,1
老师感谢周引发师生关注,感谢,一周,这是老师感谢周，不是吗？我不想在你的一周给你带来负担。,0
泼水节上误将开水当祝福,泼,开水,泼水节上，大家彼此泼水祝福，忽听一人骂道：妈的，谁泼我？旁人劝道：泼你是祝福你。骂人者道：少来这套，谁刚才拿开水泼我来着？,1
女士咨询用药问题,咨询,用药,一位女士进入医生办公室询问有关她用药的问题。,0
学生误接电话引哄堂大笑,接过,电话,上学的时候，有一天一个电话找我，同学接完递给我说：你妈妈的。 我一边接过电话一边随口说到：男的女的，大家狂笑，我被笑了4年。,1
推销员送礼后反问客户姓氏,收下,贵姓,一个推销员到客户王经理家送礼，王经理痛快的收下了，激动的推销员在出门走的时候说：老王您贵姓。,1
超市扫码误将猪蹄显示为猪头肉,放,猪头,我那天在超市看见一个看帖不回帖的人，他悄悄D把手放在条码扫描器上，只见屏幕显示：猪蹄8元，他以为机器坏了，把脸凑过去，结果屏幕上显示：猪头肉5元。,1
女性为何因错误之人而堕落,堕落,错误,女人为什么总是因为那种错误的人而堕落？,0
迷失与位置的真相,在乎,位置,如果你不在乎你在哪里，你就不会迷失。,0
警官鉴定为希拉里笔迹,回答,笔迹,警官回答说先生，这是希拉里的笔迹。,0
男子用贴片戒烟却把六片放嘴边,放,贴片,我最后通过使用贴片戒烟。我把六个放在嘴边。,1
学生清华后报复班主任被曝光,织网,猴皮筋,高中时，班主任常开导我说：“美女多如过江之鲫，你现在只需好好织网！” 考上清华后我想拿猴皮筋弹他家玻璃……,1
人们打破七年坏运气纪录,打破,运气,每个人都打破了超过七年的运气不佳的分配，以覆盖整个一生中的糟糕运气。,0
王夫人婚前被误称周夫人陆夫人,称呼,夫人,甲：“王夫人结婚前，大家都称呼她什么？” 乙：“周夫人，陆夫人……”,1
法国女孩书店交流遭遇双语文盲困境,开始,语言,星期五，我在书店，我开始和一个法国女孩说话。她是双语文盲 - 她不能用两种不同的语言阅读。,0
老师质疑眼镜漆脱问题，老板反称其具腐蚀性,脱掉,镜框,黄老师走进眼镜店，他问老板：“我的镜框脱掉漆，你卖的眼镜是不是质量有问题？” 老板说：“我的眼镜没问题，而是你这个人具有腐蚀性。”,1
有钱人用鬼推磨，没钱人用驴拉磨,推,磨,有钱和没钱的区别是，没钱的用驴拉磨，有钱的用鬼推磨。,1
知道答案的人从不被提问,知道,问题,知道所有答案的人永远不会被问到问题。,1
大学里最久的是及格文化,喊,六十分,甲问乙：“你知道大学里什么保持最久？” 乙说：“校风。” 甲说：“不对，及格最长久，历届学生都喊六十分万岁。”,1
丈夫问保险理赔，被告知二十年徒刑,得,徒刑,"一个先生帮他太太向保险公司买保险，签约完毕后,他问那个业务员:如果我太太今天晚上死了，我可以得多少？ 业务员回答道：大概二十年徒刑吧，先生！",1
加湿器与除湿机在圣诞夜展开对决,对抗,除湿机,去年圣诞节，我有一台加湿器和一台除湿机。我以为我会把它们放在同一个房间里，然后让它们对抗它。,1
女儿想回家，父亲却说看过了不用回,转,摄像头,室友和她老爸视频聊天，说想回家看看。 然后就见她爸拿着摄像头在家里转了一圈，结束后她爸说：“看过了吧？那就不用回来了。”,1
儿子买手机被宰，竟没给钱,买,手机,“孩儿他爸，咱儿子买手机被宰了！” “啊？他给了多少钱？” “他没给钱。”,1
女孩调侃拉面师傅：你拉什么我就吃什么,拉,面,拉面店柜台前，女孩正排队等候。 到她时，拉面师傅问：你要粗的还是细的？ 女孩答：你拉什么我就吃什么。,1
室友打呼噜引楼道灯亮一宿,打,呼噜,大学一室友打呼噜巨响， 有天早晨忽然问我们：“我昨晚是不是又打呼噜了？” 我下铺那哥们就说了：“你打没打呼噜我们不知道，反正楼道里声控灯亮了一宿！！”,1
狗妈妈跑得快，小狗只能跟着,跑,小狗,携同事幼女街边购物，见一时髦女郎发足飞奔，身畔一矮脚白狗慌不择路紧随其后。遂指令其目：看小狗跑得多快呀。 不料其神情不屑：狗妈妈跑得快小狗只好跟着跑啊。,1
别非要知道，烦恼自消,非要,知道,很多烦恼源于你非要知道。,1
穷人是心态，破产只是暂时,破产,穷人,我从来没有穷过，只是破产了。穷人是一种心态。破产是暂时的情况。,1
她自称乱室佳人，房间混乱成艺术,整理,房间,我不整理房间，我是乱室佳人。,1
食堂包子只剩皮，顾客误点包皮,买,包皮,食堂里，几个人谈论这里的包子只有皮而没有肉，商量完了，一个哥们就去买包子。 他估计是受了刚才的影响，说道：“师傅，给来几个包皮！ ”,1
司机紧开车致歉,开车,原谅,请原谅我在你面前如此紧密地开车。,0
现实握住手柄却总脱落,抓住,手柄,每当我抓住现实，手柄都会脱落。,1
男子复印手表称获得时间,复印,手表,我把手表复印了。现在我有时间。,0
姐姐夸机车骑手很机车,骑着,机车,姐姐说那个骑着机车的人真的很机车。,1
学生课堂睡觉被调侃,能睡,吵闹,老师：我上课，你不能睡觉。 杰吏（小声地）：我能睡，要是他们吵得不那么厉害的话。,1
立法机构会议期间安全无保障,没有,安全,在立法机构开会期间，没有人的生命，自由或财产是安全的。,1
病人因看护太瘦要求换医院,要求,看护,病人：我强烈要求换个看护。 医生：理由。 病人：她太瘦，抱不动我。 医生：她已经是我们医院最强壮的看护了。 病人：那么我要换个医院。,1
小明借题不还被列失信名单,借题,失信,小明借题发挥，所借之题至今仍未归还，当事人已被列上失信名单。,1
网友吐槽不丑不温柔的生活态度,准备,温柔,我不丑，但我也不准备温柔。,1
郑百文被误认是郑秀文哥哥,误认,郑百文,一日和老妈聊股，说到郑百文，一向喜欢唱歌的小妹很是纳闷，向我们发问道：郑百文是谁啊？随即做醒悟状，难道是郑秀文她哥？,1
网友看完帖子后未回复次日离世,看完,帖子,有个人看完此帖，没回，第二天就再也没醒来。,1
唐僧洗澡被嘲太脏，妖精自称洗洁精,洗澡,洗洁精,唐僧：“妖精，士可杀不可辱，要吃就吃，为何要和贫僧一起洗澡”。 妖精：“别误会，是你太脏，而本大王恰好是洗洁精。”,1
机会为何总敲门,敲门,诱惑,为什么机会总是敲门而且诱惑可以自由地走进去？,0
学生炫耀一毛钱引笑谈,炫耀,钱,一二货同学拿了张一毛钱在我面钱炫耀， 我说：“不就是一毛钱吗？你炫耀个毛啊。” 谁知他来了句：“你找的开吗？”,1
