headline,word1,word2,joke,label
秘书作证被曝获200克郎和水貂皮大衣,获得,大衣,一个在破产商行当秘书的女子出庭作证。 法官严厉地问：你知道作伪证会得到什么结果吗？知道，上司说给200克郎和一件水貂皮的大衣。,1
内心震惊天使出现,震惊,天使,我觉得我内心有一个天使，我一直在震惊。,0
青年误称远亲遭拒办结婚证,相距,近亲,一对男女青年到民政部门办理结婚登记手续。 办证大妈：你们是近亲，按《婚姻法》，近亲不准结婚，不予办理。 男青年：我和姑表妹家相距一百多公里呢，是远亲！,1
英美被同种语言隔开,隔开,语言,英格兰和美国是两个被同一种语言隔开的国家。,1
教堂举行豆类晚餐并伴音乐,举行,晚餐,星期二晚上将在教堂里举行一次豆类晚餐。音乐将随之而来。,0
孩子从垃圾桶找纸巾引热议,找到,纸巾,这位小朋友听后非常开心，老师问：“你的纸巾是妈妈给你准备的吧！” 小朋友骄傲的回答：“从旁边的垃圾桶里找到的！”,1
夫妻减肥奇谈：丈夫骑马导致马瘦二十公斤,骑马,马,阿冬：我太太最近为了减肥，天天都在骑马！ 阿平：结果如何？ 阿冬：马足足瘦了二十公斤！,1
把钱放嘴边显得奇怪,放,钱,如果你把钱放在嘴边，你会对其他人看起来很奇怪。,0
有人错过付款未察觉,错过,付款,想想没有人知道你还活着？尝试错过付款。,0
概括存在风险,概括,危险,所有的概括都是危险的，即便是这样。,0
程序执行错误操作,执行,操作,计算机程序会执行您要求它执行的操作，而不是您希望它执行的操作。,0
孩子被老师批评手脚不干净,洗,手脚,"儿子：“妈妈,老师说我的手脚不干净.” 妈妈：“你看你,浑身都是脏兮兮的,小孩子要讲卫生啊!我觉得你们老师说的一点也没错,快点去洗吧!”",1
记忆决定意义,记住,意义,除非你继续记住它，否则没有任何意义。,0
获得比生活更易,获得,生活,生活中的几乎所有事物都比从中获得更容易。,1
相亲现场粉底脱落后幽默回应,咧嘴,粮食,那天去相亲，对面那女的咧嘴一笑，脸上好厚一块粉掉下来了。 我顺口说：“您太客气了，第一次见面就送粮食。”,1
生存法则：伤害致胜,伤害,反击,任何不会杀死我的东西最好做足够的伤害让我不再反击！,0
丈夫问谁说了算，妻子淡定回应我,说,算,丈夫终于鼓足勇气对妻子说道：我们家到底谁说了算？ 我。妻子平静地说，怎么了？ 丈夫连忙回答：没什么，没什么，我这人记性不好，再复习一遍。,1
婚姻学历交换真相曝光,失去,学位,婚姻是一个男人失去学士学位而女人获得硕士学位的机构。,1
女性结婚后变得像男人,变得,女人,“这是因为有些女人结婚后变得像男人一样。”,1
电子邮件中的幽默笑话曝光,分享,笑话,有关电子邮件的笑话，如关于幽默时事通讯中所见。,0
个人触及超越掌握范围,触及,范围,一个人的触及范围应超出他的掌握范围。,0
手表电池寿命超人命引发争议,号称,寿命,这表号称电池比人的寿命还长，果然第二天人就死了。,1
吸烟伤肺却不会伤心,会,伤心,喜欢吸烟是因为它可以伤肺，却不会伤心。,1
人们在小世界中认识彼此,认识,小世界,我有时会去自己的小世界，但没关系，他们在那里认识我。,0
男孩因房屋朝西而起床时间不早,起床,窗户,老师：暑假里你什么时候起床？ 男孩：当第一缕阳光射进我的窗户时，我就起床。 老师：那不是太早了吗？ 男孩：噢，我的屋于是朝西的。,1
课堂提问引出惊人答案：外遇致病,发生,外遇,生物课。 老师提问：“父母都不患这种遗传病，孩子却患病，那么最有可能发生了什么？（标准答案是“基因突变”）” 后排阴暗角落里响起低沉却清晰的男声：“外遇。”,1
换工作竟用110接人引热议,打,电话,最近好吗？我换工作了，电话也改了，现在我手底下有些人，也有专车，你以后有事想找我，只要打个电话，他们就会开车去接你的，你把电话记一下：110。,1
飞机晚点却准时到达引发乘客热议,转移,飞机,当您所在的飞机晚点时，您想要转移的飞机准时到达。,1
男生放学后纠缠女生引出家庭误会,纠缠,姐姐,一日放学后，一男生一路跟着我，纠缠不休。 到家后，小弟见那人还在门外不远处站着，自告奋勇去轰他走。 小弟出去大喊：没眼光，看上我姐姐！,1
失物招领处收走人们不想拥有的东西,归还,东西,失物招领处是让人们归还他们发现但不想要的东西。,1
设备每3个月或3000英里获关注,获,关注,至少那时他们会每3个月或3000英里受到一点关注，以先到者为准。,0
蚌用珍珠付餐费引热议,忘带,珍珠,蚌在饭店吃完饭，准备结帐时，突然发现忘带钱了，便对店主说：“糟了，我出来时走得匆忙，忘带钱了。请问在你们这里可以用珍珠付账吗？”,1
死刑犯请求吃芒果引热议,等待,芒果,一个死刑犯被押上刑场，法官问：你最后还有什么要求吗？ 犯人答：我想吃芒果。 当官：可现在不是芒果成熟的季节呀！ 犯人：那我就等着好了。,1
学生误将路遥当成相马人,知,马力,语文老师问：“那位同学听说过当代著名作家路遥？” 下面一学生站起来大声说道：“老师，路遥不是作家，是相马的，路遥知马力吗？”,1
年龄增长反而带来辉煌？网友笑疯,走向,辉煌,如果随着年龄的增长情况变得更好，我即将走向辉煌！,1
入侵者遭建议未果立即发现,发现,入侵者,推论2：任何唠叨的入侵者，如果没有得到应有的建议，就会立即发现。,0
女性追求者竟包括蚊子,追求,蚊子,如果算上蚊子，女性确实会追求我。,1
饭店给党员打五折被记者揭穿,打,折,某饭店开业酬宾标语上写着:党员5折 记者来采访。 记者:你们为什么要给党员打五折呢？ 服务员:您是党员吗？ 记者:不是 服务员:那四折！,1
司机缺钱妻儿拥有所有,拥有,现金,司机没有现金。妻子和孩子都拥有这一切。,0
两名男子凌晨离赌场回家,离开,赌场,两名男子在赌场，刚刚凌晨3点离开回家,0
男人聪明如天气，女人傻似预报,变天,天气,的男人聪明得像天气，多变。有的女人傻的像天气预报，变天她都看不出来。,1
饮料配方意外加入奇异鸟,混合,猕猴桃,当他们制作猕猴桃草莓饮料时，他们会混合一只奇异鸟。,1
两人被火车撞死,撞死,火车,两个小时后，他们都被火车撞死了。,0
网友成替身，酒肉朋友变稀有,叫,网友,以前朋友可不是酒肉关系；现在一次面也没见过的都叫网友。,1
音乐家梦碎：平凡中寻自我,发现,音乐家,我最好的工作是成为一名音乐家，但最终我发现自己并不值得注意。,0
丈夫一句玩笑引发妻子泪崩,回,大象,"结果老公淡淡的回了一句:""大象也是吃这些长大的。"" 我泪……",1
中国人一生中国，祸不单行,卒于,中国,生在中国又卒于中国，真是祸不单行啊,1
丈夫报复卖错奶牛,尝尝,奶牛,妻子不解，于是他又解释说：两年前，这混蛋卖给我的奶牛根本挤不出奶，我现在也要让他尝尝受骗的滋味。,1
男子勃起后误以为打破阴茎,勃起,鸡巴,你曾经勃起醒来，翻身，并认为你打破了你的鸡巴？,1
丈夫建议学习园艺以省去园丁费用,学习,园艺,丈夫：我认为你应该学习一些园艺，然后我们可以不用园丁。,0
监狱长意外入睡,睡着,监狱,世界上一座大监狱，我是监狱长。幸运的是，我也睡着了。,0
男子惊呆却保留话术让女方挑羊,保留,羊,他惊呆了，但保留了他的话，允许她挑出一只羊。,1
直觉弥补判断力缺失,弥补,判断,我的直觉几乎弥补了我缺乏自我判断力。,1
婴儿出生无膝盖帽，2至6岁才出现,出现,膝盖帽,婴儿出生时没有膝盖帽。它们直到孩子达到2至6岁才出现。,0
盖伊揭秘赌博原因,喜欢,赌博,盖伊：为什么我是这样做的。喜欢赌博。,0
恋爱条件竟然是废话,说,废话,女人：恋爱的条件是什么？ 男人：男人、女人。 女人：废话！ 男人：对，还有一堆废话！,1
网友呼吁梦中别被叫醒,别,醒,当我做梦的时候请别叫醒我，让我自然醒。,1
女性缺席时才被交谈,交谈,女性,当且仅当她们不在时，女性才会与您交谈。,0
网友曝懒癌患者半途而废现象,喜欢,半途,我有懒癌，做事喜欢半途。,1
士兵沙漠弃甜点,放弃,甜点,士兵决定在沙漠中放弃他的甜点。,0
幸运事故引伟大发现,发现,事故,没有一个伟大的发现，只有非常幸运的事故。,0
有钱败家，没钱拜神,败家,钱,有钱就败家，没钱就拜神。,1
司机挂踏板引发刹车灯异常,挂起,刹车灯,我把加速踏板挂在车上，刹车灯。,0
阁楼未清空，巢仍非空,出来,巢,在他们所有的东西都没有从阁楼里出来之前，巢不是空的。,0
爱情与时间：无法购买却必须花费的珍贵之物,花费,时间,爱情与时间：生命中唯一的两件事，也是全世界无法买到但却花费的。,1
文科学位持有者突发薯条需求,想要,薯条,我拥有文科学位 - 你想要薯条吗？,1
医生脉搏像钟表一样平稳,按,手表,你一切都很正常，内科医生粗气地说，你的身体好极了。啊唷，你的脉搏像钟一样平稳。 可是，医生。病人嘀嘀咕咕地说，你的手指是按在我的手表上啊！,1
别问他人愚蠢，他们将展示你的无知,展示,愚蠢,永远不要问有人是多么愚蠢，因为他们会转身向你展示。,0
未经同意不得引发自卑情绪,感到,自卑,没有你的同意，任何人都不会让你感到自卑。,0
研讨会将探讨时间旅行,举办,时间旅行,两周前将举办一次关于时间旅行的研讨会。,0
宝宝误称蚊子撒尿引发网络热议,撒,尿,宝宝惊醒了，大叫：妈妈，蚊子刚才在我的屁股上撒了一泡尿！,1
保持口腔和心灵开放挑战重重,保持,开放,同时保持口腔和心灵开放并不容易。,0
演唱会误称读者为患者引全场哄笑,打动,患者,演唱会上，一位歌手对听众说道：“请大家相信我，我一定能用我的歌声打动每一位读者，突然发现自己说错了，立马改为我一定能用我的歌声打动每一位患者。全场暴...,1
牙科护士取消预约,取消,饼干,我的牙科保健员很可爱。每次我访问时，我都会在大厅等候时吃一整包奥利奥饼干。有时她必须取消下午剩下的约会。,0
单管计算机成巨大真空管,成为,真空管,如果一台计算机只能有一个真空管，它可能也是一个非常大的真空管。,0
成功醒来意味着未入睡,取得,成功,如果你醒来发现自己取得了成功，那么你就没有睡着了。,0
男子求吻被拒后改称亲嘴,亲嘴,吻,男：“我可以吻你吗？” 女：“不要脸。” 男：“那就亲嘴吧。”,1
丈夫用‘一毛’解释爱意引发夫妻争论,爱,一毛,妻子：你有多爱我？ 丈夫：一毛钱之多。 妻子：只有这么一点么？ 丈夫：一毛钱不就是‘十分’吗？,1
颜值财富学霸真能带来爱情与工作？,以为,漂亮,你以为只要长得漂亮就有男生喜欢？你以为只要有了钱漂亮妹子就自己贴上来了？你以为学霸就能找到好工作？我告诉你吧，这些都是真的！,1
丈夫早起上班被妻质问,脱衣,上班,小张，你的气色不好，出了什么事？ 我昨晚快天亮才回家，正在脱衣睡觉时，太太醒来了，问我为什么起得如此早。我只好又穿上衣服来上班。,1
称好人为无原则,说,好人,当所有人都说你是好人的时候，你有很大几率是个没有原则的人。,1
父子对话引笑点：牛屎派脯成新梗,翻译,派脯,儿子：爸爸“ It’s a newspaper ”怎么翻译的啊？ 爸爸：你吃牛屎派脯不？,1
生活离不开打酱油,打,酱油,酱：生活离不开打酱油哇。,1
怀孕真相：婴儿服装致孕,赠送,家具,赠送婴儿服装和家具是怀孕的主要原因。,1
人们遗忘下定决心的地点,下定,决心,我喜欢下定决心，但我不记得我把它留在了哪里。,0
黑暗中找不到自己的屁股,找不到,屁股,愚蠢：在黑暗中无法找到自己的屁股。,1
课堂冷笑话引热议：满足 vs 满族,满足,满族,运筹学课上，老师问：这个解满足约束条件吧？ 学生：满足。 老师贱贱地笑着说：满族是中国的少数民族。 呃，约束条件，满足，满族，少数民族……,1
员工吃喝全靠单位报销,出,胃,公家出钱我出胃，吃喝为了本单位。,1
沉默暴露个人弱点,揭示,弱点,如果有人问你感觉如何不回答，他们只是想让你揭示自己的弱点。,0
男子出差信中称再无比妻更好的女人,证实,女人,一位绅士在出差的路上给妻子写信说：亲爱的，我昨天又一次证实，比你更好的女人再也没有了。,1
大鼠实验致癌症,患上,癌症,如果对大鼠进行实验，他们就会患上癌症。,0
乐观派竟像荼壶一样吹口哨,吹,荼壶,“什么叫乐观派的人？”这个就像荼壶一样，屁股都烧得红红的，它还有心情吹口哨！“,1
重复行为带来相同结果,做,事情,如果你总是做你一直做的事情，你将永远得到你一直得到的。,0
哑剧演员误用消音器引发热议,使用,消音器,如果你要拍哑剧，你会使用消音器吗？,1
女孩曲线越险越危险,越多,道路,女孩就像道路，曲线越多，越危险。,1
老太太吐槽警察过度反应,大惊,要饭,一个便衣警察提醒同伴：注意！要犯出现了！ 一个过路的老太太听了自言自语地说：神经兮兮，这么大个社会，出现一个两个要饭的，也值得大惊小怪！,1
为一生而生活将导致永恒后悔,后悔,生活,为这一生而生活的人只会永远地后悔。,0
人有时是鸟，有时是挡风玻璃,是,鸟,有时你是鸟，有时你是挡风玻璃。,1
被吓到两次会怎样,吓到,两次,如果你被吓到半死，两次会怎么样？,1
素食者激增致氧气骤降,减少,氧气,素食主义者的增加导致氧气含量急剧减少。,1
孙子要钱做校服被奶奶误听成孝服,做,孝服,孙子：“奶奶，给我二十块钱。” 奶奶：“干什么呀？” 孙子：“做校服。” 奶奶：“孝服？等我死了再说吧！！”,1
失明预警：看见才不会失明,看见,失明,如果你能看到这一点，你就不会失明，这是一个非常好的开始。,1
咖啡成生活重要部分,认为,咖啡,你认为咖啡是生活中最重要的事情之一。,0
悲观者担忧人工取代自动化,担心,人工,悲观主义者已经开始担心什么会取代自动化。,1
有人曾被踢头部,被踢,头部,某种感觉，某种程度上，你曾经像这样被踢过头。,0
小猫涂口红被老鼠吐槽长胡子,涂,胡子,小猫姑娘坐在镜子前涂口红，被一只老鼠看到了。 老鼠撇着嘴说:还臭美哩，一个女孩子家家还长那么长的胡子。,1
护士长宣布结业考试加分新规,扎上,胳膊,护士长阿姨看了看我，又看了看我胳膊； 沉默两秒，对后面忙碌的众小护士说： “都过来，今天结业考试提前，这个能扎上的多加10分。”,1
母乳喂养引出巧克力口味争议,喝,巧克力,有一天公园里，来了一个白人妈妈还有一个黑人妈妈。 她们都各自坐在不远处哺喂母乳。 忽然间白人小孩抬头跟白人妈妈说：“妈妈我也要喝巧克力口味的……”,1
钱带来安静,让,钱,实际上，我不喜欢钱，但它让我安静下来。,0
小船漂浮，沙滩也漂浮？,漂浮,沙滩,一条小船漂浮在水面上;但我敢打赌你也会漂浮在沙滩上。,1
棺材铺播放张学友歌曲引热议,播放,棺材,路边有个棺材铺，每天都放着同一首歌。 有一次你忍不住了进去问老板：你们这是什么歌啊？ 老板说：张学友的，总有一天等到你...,1
老太太存钱后怒称想数存款被拒,数数,存款,一个老太太取出自己在储蓄所里的所有存款，一刻钟后又重新存入。营业员不解地问她这是干什么？ 老太太生气地说：我想数数我有多少存款不充许吗？,1
司机调侃行车里程，警察幽默回应产妇消息,说,200,司机说：“200行不？” 警察说：“至少也得250，媳妇要生了。” 司机说：“成交，代我替嫂子问好。”,1
离开车站前别忘用浴室,使用,浴室,在您离开车站之前，您永远不会想要使用浴室。,0
食神夺冠后吐槽吃货妻子,吞,鸡,某人参加食神比赛，狂吞了一只鸡、9个汉堡，一大块苹果馅饼，最后赢得了冠军。 下台前，他对别人说：“别告诉我老婆，要不我该吃不到午饭了。”,1
努力忘记却无法摆脱记忆,忘记,月份,这将是一个难忘的月份 - 无论你多么努力忘记。,1
男性被占卜，难寻敏感关怀型伴侣,找到,男朋友,为什么女性如此难以找到敏感，关怀和好看的男性？因为那些男人已经有了男朋友。,1
孩子误将舅舅当猴子,看,猴子,舅舅到家里来做客，小文却对妈妈说：妈妈，我要去动物园看猴子。 妈妈立即怒声斥道：看什么猴子？你舅舅就在这儿，你还去什么动物园！,1
风吹乱发，真假难辨,吹乱,假发,风好，吹乱了我的秀发，吹落了你的假发。,1
丈夫凝视树叶遮羞画妻怒斥秋日隐喻,盯着,树叶,丈夫正目不转睛地盯着一张仅以几片树叶遮掩羞部的裸体女像油画。 妻子冲着丈夫吼到：“你是想站到秋天，待树叶落下才甘心吗？”,1
人类智力与道德局限的反思,知道,生物,人知道是非，这一事实证明了他对其他生物的智力优势; 但他能做错的事实证明了他对任何不能做的生物的道德自卑。,0
想念猫竟看轮胎引热议,想念,轮胎,你也忘记了：如果你想念一只猫，就看看我的轮胎。...,0
课程先决条件成死循环,提供,课程,只有在所需课程后的学期中才能提供所需课程的先决条件。,1
程序员座右铭：无法修复即破产,修复,破产,维护者的座右铭：如果我们无法修复它，它就没有破产。,1
可食用内衣消失引关注,洗了,内衣,我洗了可食用的内衣，现在它们已经不见了。,0
九成医生承认同行是白痴,同意,医生,十分之九的医生会同意十分之一的医生是白痴。,1
老师在圆里放P点引热议,放,P点,上数学课，老师讲几何。 画完图后，他在圆里画了一个P点，向我们大声宣布：“看，我在圆里放了个P！”,1
父亲银行偷笔被捉,偷,笔,我来自一个愚蠢的家庭。我父亲在一家银行工作。他们抓到他偷笔。,0
上帝让白痴办学校董事会,让,学校,上帝让白痴进行练习，然后他成立了学校董事会。,1
王冠与珠宝的真相曝光,找到,王冠,你头上的王冠是找到珠宝的吗？,0
车主保险杠再次掉落引发网络热议,掉下来,保险杠,如果你能读到这个，你要么太近了，要么我的保险杠再次掉下来。,1
海明威收一元钱只回一个谢字,寄,样品,一个妒嫉的人写了封讽刺信给海明威：我知道你现在的身价是一字一金。现在附上一元美金，请你寄个样品来看看。 海明威收下那元钱，回答了一个谢字。,1
重复工作被指为剥削,剥削,工作,如果她有一个无聊的重复工作，低薪，这是剥削。,0
百岁老人笑谈无就业压力,带来,压力,记者采访一位百岁老人，问：“您老作为一位百岁老人，您现在感到最高兴的事情是什么？” 老人想了想说：“没有同龄人带来的就业压力！”,1
难过时吃糖，生活变甜,吃,糖,难过时，吃一粒糖，告诉自己生活是甜的！,1
学生因乱扔垃圾被老师警告,扔,垃圾,要不是老师说不能乱扔垃圾，不然偶早把你扔出去。,1
官僚制将能源转为垃圾,转化,废物,官僚制：将能源转化为固体废物的方法。,1
中国性教育缺毛片成空白,缺少,毛片,如果没有毛片，中国的性教育简直就是一片空白！,1
睡觉必须闭眼,需要,闭眼,生活小常识：睡觉需要闭眼。,1
4000年未有新动物被驯化,驯化,动物,在过去的4000年里，没有新的动物被驯化。,0
核冬致蝴蝶灭绝,杀死,蝴蝶,我们也有逆蝶效应：核冬（O）杀死蝴蝶（A）。,0
网友调侃看事难伸头,看待,屁股,我试图从你的角度看待事情，但我无法把头伸到我的屁股上。,1
有人必须做肮脏工作,必须,工作,这是一个肮脏的工作，但有人必须把它当作其他人。,1
弟弟乱用成语送水果惹笑,自食,恶果,弟弟爱乱用成语，有一次伯父来家吃晚饭，饭后，弟弟把伯父送来的水果切好，并且对着伯父说：请自食恶果吧！,1
手榴弹扔进法国厨房引关注,扔进,厨房,当你把手榴弹扔进法国的厨房时，你会得到什么？,0
缝纫机免费调整服务,调整,缝纫机,我们将为你的缝纫机加油并调整家中的张力，价格为1.00美元。,0
有效政府等于独裁,拥有,政权,当你拥有一个有效的政府时，你就拥有独裁政权。,1
微笑用肌少于皱眉,需要,肌肉,微笑比皱眉需要更少的肌肉，更少的人完全无视某人。,0
美国总统任免随意引发争议,当,总统,在美国，任何人都可以当总统。这是你冒的风险之一。,1
喝酒误称引发同学爆笑,说错,爸爸,有一天去同学家吃饭，喝了点酒，她爸爸忽然进来了，本来是想喊叔叔的，结果说错了，说：爸，来座！ 寒！大帮同学笑得要死。,1
议员午餐吐槽土豆占比过高,占了,土豆,一个议员在饭店进午餐。 饭店老板：“您喜欢刚上的这道菜吗？议员先生。” “还可以，只是土豆在整个菜里占了绝对多数。”,1
网友吐槽频段使用困惑,在,频率,当其他人在另一个频率上时，你怎么会在一个频率上？,1
奉承下雪时有效，收获也随之而来,奉承,收获,奉承确实有效：当你下雪的时候，你也应该收获。,0
学生抄作业被老师发现后尴尬回应,抄,材料,你干吗把材料拿到桌子底下抄阿？？？？ 某君：阿？？？哦！！！！老师，我……习惯了……,1
猪流感引发总统种族猜测,飞,猪,乔治华盛顿说：“当猪飞的时候我们会有一位黑人总统！”......好吧，猪流感。,1
爬山获溃疡新发现,得到,溃疡,溃疡是你从爬山过鼹鼠身上得到的东西。,0
情侣分手竟成伤害方式,分手,伤害,让我们分手......我们可以用这种方式做更多的伤害。,1
网友威胁网友：名字写裤衩上,写,名字,再敢惹我 把你名字写在我裤衩上 放屁崩死你！,1
歌星怒骂狗仔队遭爱狗人士暗杀,怒骂,狗仔,歌星怒骂狗仔队遭爱狗人士暗杀。,1
员工称陪妻打麻将为薪水回收,回收,薪水,同事问小王：“你常常陪你太太玩麻将，你觉得跟她玩麻将有意思吗？” 小王说：“只有利用这办法，才能回收部分薪水！”,1
丈夫调侃妻子像维纳斯却无人偷走,偷走,维纳斯,妻子：你说我长得像维纳斯吗？ 丈夫：像，简直一模一样。不过怎么没人把你偷走呢？,1
学生幽默回应作业漏网之鱼,投,鱼,老师催促同学交作业。他扬了扬手上的练习本，问：都交齐了吧？不会有漏网之鱼吧？ 有位学生怯生生回答：老师，那条鱼明天自投罗网可以吗？,1
胜利后无人轻视比赛,获胜,比赛,当他们的球队获胜时，没有人会说，“这只是一场比赛”。,0
女性脚小或为进化靠近厨房水槽,靠近,脚部,为什么女性的脚比男性小？它是那些“进化的东西”之一，使他们能够更接近厨房水槽。,1
40年后老太太将流行纹身,穿着,纹身,你是否意识到在大约40年后，我们会有成千上万的老太太穿着纹身？,1
第五支入侵部队领导人向总司令汇报,汇报,部队,想象一下，如果你将...第五个入侵部队的领导者对总司令说话......,0
单身汉为何税收丰厚却开心,开心,税收,税收丰厚的单身汉; 他们为什么要这么开心？,0
家长停电后孩子误看电视引发笑点,去看,电视,今早一醒，女儿老吵着上网 一开才发现停电了，我无奈的说：“今天停电了，我们明天才看好么？” 哪知她很随便地说了一句：“那......我去看电视。”,1
作家反讽素食初衷竟是为牛鸡健康,提倡,健康,一次，一位学生问大作家艾·巴·辛格：您提倡素食，是否由于健康上的原因？ 我吃素食，纯粹是为了牛和鸡的健康。作家幽默地说。,1
孩子花言巧语被赞胜过同龄人,花言,巧语,亲爱的，你有什么根据说我们的孩子将来成为政治家？ 太太，他满是不着边际的花言巧语，在这方面，他胜过许多孩子！,1
温雅非枪支成员,问道,成员,当你的妻子问道时，温雅不是那个用枪支付步枪的成员。,0
