headline,word1,word2,joke,label
围栏另一侧草更绿 水费却更高,打赌,水费,如果围栏另一侧的草更绿，你可以打赌水费更高。,1
父子对话引爆笑点,放屁,闻着,我儿子一日一同学聊天，下面是一段他们的对话。 他同学：你放屁。 我儿子淡淡的说了一句：你闻着都香。 我憋笑憋成内伤……,1
妈妈用舔手指翻iPad书页,舔,手指,儿子拿了个iPad对妈妈说：“你瞧，可以在上面看书呢。” 妈妈很是惊奇，拿过来iPad看了看，然后舔了舔手指去上面翻页。,1
丈夫沉迷网络无用事实引担忧,寻找,事实,我的丈夫总是在网上试图找到无用的事实。我担心他是一个“信徒”。,0
学生作文无标点引老师质疑,抢救,标点,老师：你的作文《抢救伤员》中怎么一个标点符号都没有呢？ 学生：这么急的事怎能停顿！,1
女人最爱花钱买幸福,喜欢,花钱,女人一生喜欢两朵花：一是有钱花，二是尽量花！,1
员工放屁被吐槽后开启振动模式,调成,振动,一人在办公室老是放响屁，同事忍不住说：你能不能不出声？然后便见他坐在那摇来晃去抖个不停，问：干什么？回答说：我调成振动的了！,1
高尔夫每月需放弃两次,放弃,高尔夫,法律1：高尔夫应该每月至少放弃两次。,0
思想远者滚得远,滚,思想,思想有多远，你就给我滚多远!,1
战争未解，一人决断,解决,决定,战争什么也没解决。它只剩下一个人做出决定。,0
旧时课堂体罚真相曝光,做,俯卧撑,我们上学那会儿老师可以体罚学生的， 一般情况下是男生做俯卧撑，女生做下蹲， 做的时候老师在边上说：我这是为了你们好，等你们长大了就明白了。,1
书山学海竟用八宝粥应对,干为,八宝,"书山有路先干为净,学海无涯八宝作粥。",1
推销员遭市场冷遇：仅两反应,滚出去,住口,巡回调查几个星期的推销员回来向上司报告：“市场上只有两种反应。” “哪两种？”上司问。 ‘滚出去’和‘住口’两种。,1
太阳晚上不亮因靠太阳能发电,靠,太阳能,太阳一定是靠太阳能发电的，一到晚上就不亮了。,1
孩子担忧家用打气筒气用尽,用光,打气筒,邻居常借我家打气筒用。一天，4岁的女儿珍妮突然对我说：“爸爸，把咱家打气筒里的气用光了可怎么办呢？”,1
父亲背娃，女儿反向要求背父,背,爸爸,周末带二岁女儿逛街，她说累，爸爸立马把她背起来。 我也喊累。 女儿很认真的：妈妈，等你长小了，我背你。,1
考拉觅食引发桉树狂潮,觅食,桉树,你有没有觉得像考拉觅食狂潮的桉树？,0
每项成就皆经斗争终获胜利,斗争,胜利,每一个有价值的成就，无论大小，都有其苦差事和胜利的阶段; 一个开始，一个斗争和一个胜利。,0
女士在书店找丈夫引笑,找,丈夫,逛书店时，我听见一位女士问店员电脑书籍部在哪儿，店员领她到书店后面一个角落。 问她：你有什么特别要找的？ 那位女士说：我找我丈夫。,1
情侣互爱展现完美关系,爱,自己,我的女孩和我，我们是如此完美，她爱我，我也爱自己...,0
拖延课程推迟,克服,课程,注意：如何克服拖延课程已被推迟。,0
夫妻对话诡异：耳朵出话进嘴,出来,耳朵,我的妻子说，当她告诉我一些事情时，它会一只耳朵从另一只耳朵里出来。当我告诉她一些事情的时候，它会进入双耳并从嘴里出来。,1
长寿秘诀曝光：虚报年龄成新潮流,虚报,年龄,长寿的三个秘诀：不抽烟不喝酒虚报年龄。,1
女生迟到竟为新裙子面子,穿,裙子,校园里的女孩子真爱“面子”。 问：你上课迟到怎么还敢从前门进？ 答：你没看到我穿了条新裙子吗？,1
家长会曝光老师点名送礼家长,点名,花圈,花圈店的老板娘开完家长会对老公说：“现在的老师太过分了，会上居然说谁的家长给他送了礼，表示感谢。” 老公说：“那你不问他，送个花圈他谢不谢？”,1
爱与生活中的荆棘,充满,生活,充满爱的生活会有一些荆棘，但没有爱的生活就没有玫瑰。,0
男性透过女性看常失踪,看,女性,那些说自己可以透过女性看的男人很少失踪。,0
路人自称得了蒋介石,得了,蒋介石,病人甲：我得了胆结石了。 病人乙：我得了肾结石了。 路人甲：我得了蒋介石了。,1
袜子有洞却能穿进脚？,伸,袜子,安安：“你的袜子上有洞吗？” 卡勒：“没有。” 安安：“那么，你是怎么把脚伸进去的呢？”,1
聋哑瞎三人互骗事件,听见,钱,聋子听见哑巴说瞎子看到了钱，统统都是骗人的。,1
明日取消签证,取消,签证,吃喝玩乐，明天他们可以取消你的签证。,0
谎言会催生律师？父亲警告儿子别撒谎,产生,谎言,父亲和他的儿子说话：“儿子，你不应该撒谎。一个谎言会产生另一个谎言，然后是另一个谎言，在你知道之前，你就是律师。”,1
成熟智慧似疲惫,显得,智慧,令人惊讶的是，“成熟的智慧”有多么像是太累了。,0
女儿吐槽父母年龄差惊人,害羞,大四,女儿问妈妈：爸爸从前害羞吗？ 要是他不害羞，你现在至少大四岁！,1
成人礼上男子酒后追猪被质疑兄弟情,追着,猪,你以后要注意点自己的形象，已经是大人了，别老跟以前似的。少喝点酒，昨晚又有人看见你端着酒杯追着一头猪，还大叫：你是不是兄弟？是兄弟就干了！,1
人们回归原点的思考,回到,原点,出去有什么意义？无论如何，我们还是要回到这里。,0
车主自嘲车款命名趣事,自行,自卸,人家的车是自卸的，我的车是自行的。,1
假期只帮有需要者引发争议,考虑,贫穷,为什么在假期期间只考虑有需要的人？在一年中的其余时间里，他们不是一样贫穷吗？,1
动作引发过度反应,引发,反应,对于每一个动作，都会有相应的过度反应。,0
老师建议自杀者从一楼开始逐层尝试,跳楼,一楼,老师说，如果你想跳楼自杀，没事，慢慢来， 从一楼开始挨层都试一下，保证你不想死了,1
巴黎街头出现会行走的连衣裙,行走,连衣裙,在巴黎服装店外面：街头行走的连衣裙。,1
成功越多亲戚越多,越多,亲戚,成功是相对的 - 成功越多，亲戚就越多。,1
老师调侃学生口头禅,知道,口头禅,老师：菲利，你们班上有一些同学有一句口头禅，你知道是什么吗？ 菲利：不知道。 老师：说得对！,1
网友调侃‘没有你’支撑生活,感觉,东西,没有你，你有没有感觉到你的东西已经支撑了？,1
男生误听体育课通知跑向教室,跑向,教室,体育课时，体育老师说：今天来月经的同学可以不用上。 话音刚落，就看见几个男生大步流星地向教室跑去……,1
错误最终被忽略,忽略,错误,在您选择忽略它之前，错误不会成为错误。,1
妈妈藏货省塑料袋引宝宝疑问,藏,塑料袋,baby看到她妈妈将超市里的东西藏在衣服里就问妈妈： 妈妈，你为什么不把东西放在篮子里呢？ 妈妈：这样省塑料袋啊,1
撞击时刻装备检查,撞击,装备,在撞击的那一刻，你有什么装备？,0
妈妈游泳像美人鱼引孩子发笑,像,美人鱼,妈妈：游泳真好 小新：妈妈，你愈来愈像鱼了！ 妈妈：你是说像美人鱼吗？,1
车主吐槽尾随被贴纸劝退,购买,保险杠,如果你不喜欢我的尾随，请购买更大字的保险杠贴纸。,1
山狮吃公牛后咆哮,吃,公牛,吃了整只公牛后，一头山狮感觉很好，他开始咆哮。,0
生活看似平凡却并不可怕,醒来,生活,我的生活真的不那么可怕 - 我醒来的时候似乎就是这样。,0
市民怒砸市政厅,炸掉,市政厅,你无法与市政厅作战，但你真的可以把它炸掉。,1
慢跑时冰块掉落困扰,掉落,冰块,我曾经慢跑，但冰块一直从玻璃杯里掉出来。,0
小学生误称北京紧挨首都引发网络热议,映,朝阳,“一轮红日映朝阳……作为新时代的小学生，我们深知北京紧挨首都。”,1
香蕉复秤竟真有5斤,复秤,香蕉,在小摊上买了5斤香蕉，回来复秤，居然真的有5斤。,1
完美妻子的真相：洗碗是关键,帮助,洗碗,一个完美的妻子是一个帮助丈夫洗碗的人。,1
五官复杂却智商朴素引热议,掩饰,智商,你复杂的五官，掩饰不了你朴素的智商。,1
学生抽烟被化学老师怒斥,遇到,氨气,我们高中化学老师问男同学：“氨气遇到火会不会爆炸？” 他怯答：“会。” 老师大喝一声：“那你还敢在厕所抽烟！”,1
疯狂遗传自子女,得到,疯狂,疯狂是世袭的。你从孩子那里得到它。,1
银行24小时营业引笑：顾客没时间,看到,时间,我看到一家银行说“24小时银行业务”，但我没有那么多时间。,1
情侣解读维纳斯雕像裸体原因,脱掉,衣服,美术馆里，一对情侣站在维纳丝的雕像前， 女孩嘀咕说：维纳斯为什么没有穿衣服呢！ 男子坏笑道：要做女神，得先脱掉衣服，减轻重量，才能飞得起来。,1
同学春光外泄被哥哥吐槽家丑外扬,外扬,春光,一天，同学和哥哥一起上街，裙子突然被大风吹起来，同学惊慌地按着扬起的裙子大喊：“天啊！春光外泄！” 哥哥白了她一眼说：“拜托！家丑外扬吧！”,1
政治家似诚实窃贼,像,窃贼,一个优秀的政治家就像一个诚实的窃贼一样无法想象。,1
镜子催学习：自嘲成动力,照一照,镜子,如何激励自己努力学习？请看如下办法： 在书桌上放一个小镜子，不想学习时照一照。这时，你就会想：孩子呀！都长成这样了，不好好学习可咋整啊？！,1
受欢迎决定人际成败,喜欢,人们,受欢迎很重要，否则人们可能不喜欢你。,0
邻居困于圆形车道无法离开,无法,车道,我的邻居有一个圆形车道......他无法离开。,0
会议记录权被剥夺引发尴尬,宣布,记录,董事长问新来的总经理：每次开会时大家都不注意听，有什么办法？ 总经理说：这好办，不要秘书参加会议，开完会后再宣布这次由谁做记录。,1
男人吐槽婚姻三重失败原因,缺乏,判断力,一个男人自我总结道：“我因为缺乏判断力而结婚，因为缺乏忍耐力而离婚，因为缺乏记忆力而再婚。”,1
变老是种特权,变老,特权,不要后悔变老。对许多人来说这是一种特权。,0
测量结果揭示身材比例,测量,身材,我的测量结果是36-24-36你看起来像什么？,0
男子误买桑塔那2000被讽去对面买奔驰,买,桑塔那,一个人拿着2000元要买桑塔那2000，女店员很奇怪，那人说道：你们门口不是写着吗？ 卖桑塔那2000。女店员客气地说：哦，那样的话，你到对面店去吧，那儿卖奔驰600.,1
教材错漏：东方红发射竟说真空能传声,播放,真空,八年级下册，第六单元第一课 其中说：东方红一号发射上天之后，不断地播放《东方红》，声音响彻天空，中国人民都激动地流下眼泪。...... 尼玛！不是说真空不能传声吗？？！,1
高尔夫玩家发球两次引热议,摆动,发球,业余高尔夫球手是两次发球的人：一次摆动之前，一次摆动之后。,1
找工作比留岗更难,找,工作,找工作要比保留工作要困难得多。,0
领导被员工吐槽内讧实为内扛,起,内讧,领导：绝对不允许我们内部自已人和自己人起内扛。 员工：领导是内讧（hong四声），不是内扛。 领导狡辩：对呀，起了内讧，不就扛上了吗？,1
网友调侃‘尝试尝试’引发热议,尝试,尝试,我不能保证我会试试。但我会尝试尝试。,1
醉酒之意不在翁,醉酒,之意,先生：醉翁之意不在酒。MM：醉酒之意不在翁。,1
年轻人死后天堂排名第三,去,天堂,一个年轻人死了，去了天堂，在那里他发现他在珠光门中排名第三。,0
颜值与丑陋无关,你的,丑,你的丑和你的脸没有关系。,1
的士走直道引热议,走,直道,坐计程车去火车站，的士司机居然不兜圈子而走直道。,1
三人酒吧遇险，一人躲藏,走进,酒吧,两个人走进酒吧。第三个躲了起来。,0
著名家庭成员难以安葬,难以,埋葬,他的亲人特别难以埋葬这位非常着名的家庭成员。,0
天使因轻松而能飞翔,飞,轻松,天使可以飞，因为他们自己很轻松。,0
丈夫炫耀育儿智商，妻子反讽自己智力在线,给,智力,丈夫：你信不信？咱们儿子的智力肯定是我给的。 妻子：当然，不是你，还会是谁给的呢？我的智力还在呢！,1
加拿大人友好时更礼貌,表现,礼貌,加拿大人在他们友好时比美国人粗鲁时更有礼貌。,0
小便池警示：孩子未来掌握在您手中,掌握,未来,[在小便池上方看到]您孩子的未来掌握在您手中。,1
警察调查需访问脱衣舞俱乐部,访问,俱乐部,在所有警察调查期间，有必要至少访问一次脱衣舞俱乐部。,0
夫妻签署共同自杀协议引热议,签署,协议,我丈夫和我没有签署婚前协议。我们签署了一项共同自杀协议。,0
程序员吐槽编译时 vs 运行时的拖延困境,推迟,编译,永远不要推迟到运行时在编译时可以做什么。,1
有人头撞下来引发争议,坐在,头撞,这并不是说我希望对这个人有任何伤害，我只是说我可以高兴地坐在旁边，而有人把头撞了下来。,0
人总在犯新错误,制作,错误,我从不重复同样的错误，因为我制作了各种各样的错误。,1
学生用伤痕代替盖章引发课堂笑料,盖章,藤鞭,老师：你没有把你的试卷让父母看吗？ 学生：看过了。 老师：那怎么没有家长盖章？ 学生指着手臂上的藤鞭伤痕：章盖在这里。,1
学生因衣服未干缺席英语课,没干,衣服,今天上英语课，老师问怎么某某同学没来， 他寝室的说道：“老师他衣服没干，没得可穿。。。”,1
猫屎覆盖真相曝光,覆盖,猫屎,猫不干净，它们只是被猫屎覆盖！,1
双脚落地永不脱裤,放在,裤子,将双脚放在地上，你永远不会脱掉裤子。,0
曲棍球妈妈挑战足球妈妈,打败,妈妈,我的曲棍球妈妈可以打败你的足球妈妈。,0
河马饭店点餐奇谈：要求菜切大一点,切得,菜,河马去饭店吃饭，一进门就和服务员说：“服务员，告诉厨房的师傅，做菜的时候务将菜切得大一点，吃你们的菜总是夹牙缝。”,1
男性内心隐藏的儿童欲望曝光,隐藏,孩子,每个真正的男人都隐藏着想玩的孩子。,0
包子与米饭结婚引热议,洗,桑拿,包子和米饭结婚。 众不解，问原因。 包子：那天去电饭锅洗桑拿，碰到刚出浴的米饭，皮肤那个白，那个好，结果就粘住了。,1
自杀声明幽默解读：退出职场的神操作,退出,自杀,自杀是告诉上帝，你不能解雇我，我退出!!!!!,1
整洁办公室竟成脑病信号,体现,头脑,一个干净，整洁，有序的工作场所是一个生病的头脑的明确标志。,1
太空入侵者被称最好游戏,认为,游戏,你曾经认为太空入侵者是“有史以来最好的游戏”。,0
老林摸光头被调侃像太太的咪咪,抚摸,光头,一日，老林突然抚摸老王的光头，然后说：“你这个光头，摸起来可真像我太太的咪咪。” 老王笑笑地摸摸自已的光头，然后颇有同感地说：“嗯！的确！”,1
对方提出更好条款前投降,投降,条款,现在投降 - 在我必须为你提供更好的条款之前。,0
馒头婚礼新娘变花卷,变成,花卷,两个馒头恋爱准备结婚。婚礼那天，馒头新郎发现新娘变成了花卷，亲爱的，你怎么了？ 讨厌，我穿的是婚纱。,1
中国夫妇养育弱智婴儿引关注,养育,婴儿,你有没有听说过这对有弱智婴儿的中国夫妇？,0
左撇子因用右手产品致死,丧生,产品,每年有超过2500名左撇子人因使用右手产品而丧生。,0
布斯兄弟救林肯之子,拯救,生命,约翰威尔克斯布斯的兄弟曾经拯救了亚伯拉罕林肯的儿子的生命。,0
解释即掩饰，掩饰即讲故事,解释,故事,解释就是掩饰，掩饰就是讲故事！,1
孩子称同学脑子最贵因从未使用,说,脑子,皮皮说：妈妈，我知道谁的脑子最贵吗？ 妈妈问：谁的 皮皮说：我班王硕的。 妈妈：为什么？ 皮皮：因为他的脑子是全新的，从来不用过！”,1
事业与生活应分开,分开,生活,你不应该把你的事业与生活混为一谈。,0
内向外向工程师差异探析,区分,工程师,问题：你如何区分内向和外向的工程师之间的区别。,0
市民雨中求助是否带伞,问,伞,我在的城市下雨了，你能不能问问我带伞没有，再不问雨都要停了。,1
父亲劝女儿与母亲同行,让,妈妈,女儿：噢！谢谢爸爸！可我真的不愿离开妈妈…… 父亲：我理解，所以我让你妈妈和你一块儿过去。,1
专家建议避免脾气暴躁,避免,脾气,我的建议：避免夸张的脾气暴躁。,1
孟母三迁被调侃：搬一百次也无效,搬,儿子,孟母三迁的故事其实说明她是有个好儿子，如果换了我，搬一百次家也没用！,1
家长愿望翻车：女儿只想股票涨和免费乘车,希望,乘车,爸爸：我希望女儿将来考上大学。 妈妈：我希望女儿将来当工程师。 女儿：不对，爸爸希望股票涨到40000点，妈妈希望乘车不付钱。,1
避免麻烦发生,避免,麻烦,不要开始任何麻烦，也不会有任何麻烦！,0
阿凡提幽默回应寒冬准备,打,哆嗦,冬天快到了，有人问阿凡提：今年冬天非常寒冷，你做好过冬准备了吗？ 还能做什么，我做好了打哆嗦的准备。阿凡提苦笑道。,1
饭馆内急被坑，公厕收费暗藏玄机,告知,公厕,有一个人去饭馆吃饭，席间内急。被服务员告知：到对面有公厕，我们和他约定不收费。但到了那儿你要对他说：我是来吃饭的。,1
学生用武术踢孩子屁股,踢,武术,我的荣誉学生用她的武术训练来踢你孩子的屁股。,0
婚姻是坟墓？小三却掘坟陪葬,掘坟,陪葬,问：既然婚姻是爱情的坟墓，那为什么还有小三掘坟呢？ 答：陪葬品丰厚。,1
顾客误购鞋店牌组引笑料,询问,牌组,"你进了一家鞋店，询问他们是否有4,6或8副牌。",1
人们迷恋伟人故事而非做自己,迷上,故事,伟人都告诫我们要做自己，但我们却都只爱上了伟人的故事，迷上了他们的经典。,1
警察靠闻呼吸查酒驾引笑料,闻到,啤酒,如果一个警察闻到你的呼吸啤酒，你就会得到一个呼气测醉器。,1
室友互赠水果引发误会,拿,葡萄,室友买了一袋苹果回来，对我们说：“一人拿一个苹果吃吧。” 我带了一袋葡萄回来，也对大家说：“一人拿一个葡萄吧。”,1
网友自嘲乱丢脸面遭冷遇,乱丢,面子,自己把脸到处乱丢，就别指望别人给你面子。,1
新年工资涨幅不及物价上涨,总结,工资,新年了，大家都喜欢总结过去一年的感受。 王民说：“天增岁月人增寿，工资涨幅总不够。” 张风说：“爆竹声声除旧岁，要买东西依然贵。”,1
两个月亮引热议：浪漫还是倒霉？,发痴,月亮,朦胧月下，小女友依偎在我怀里发痴：如果天上出现两个月亮会不会更浪漫些呢？ 我：不知道，我就知道要是有两个月亮的话你们女孩就更倒霉了……,1
物质在宇宙观下发生转变,接受,物质,一旦你能够接受宇宙，物质就会变成什么东西，穿上带格子的条纹变得容易。,0
小学生误说给爷爷娶新娘引哄堂大笑,娶,新娘,小明很高兴很天真的回答说：“给我爷爷娶新娘。” 众人无语，旁边的奶奶差点晕过去,1
女友考验男友：吻后必打耳光,吻,耳光,佳丽领着新结识的男友来到自己的家，到了家门口，佳丽对男友说：你现在可以吻我，但是随后我得打你一个耳光，因为我爸爸正在窗口往外看呢。,1
情侣用水果比喻憔悴状态,亲亲,核桃,mm：最近你不在我身边，我憔悴多了。眼睛比核桃还黑，脸比柠檬还黄，嘴比葡萄还紫。 gg：那我就亲亲核桃，吻吻柠檬，尝葡萄。,1
迷路女生被教授误导：读书才能上大学,努力,大学,MM找大学迷路了。遇见一位文质彬彬的教授。 MM：请问，我怎样才能到大学去？ 教授：只有努力读书，才可以上大学。,1
猴子松懈被取代，员工加压爆胎,增加,压力,老板：马戏团的一只猴子以为生活无忧，没有压力，不认真表演，最后被其他猴子取而代之。 员工：自行车的气已经打足，还要拼命增加压力，最后轮胎爆了。,1
页面最后更新时间,更新,页面,本页最后更新于2002年3月29日星期五。,0
年轻人尚不懂世事,懂,年轻,我还没有年轻到什么都懂的地步。,1
行为影响未来选择,影响,选择,现在做了什么，受到你当时做了什么的影响，并将决定你现在做什么。,0
早睡带来健康却引发无聊,让,无聊,早睡 - 让你健康，富裕，无聊。,1
学生作弊通过道德课,作弊,课程,我通过了我的道德课程。当然，我作弊了。,1
鸡在过马路引发热议,过,马路,请记住，过马路的鸡是运动中的家禽。,0
绅士选择不演奏风笛,选择,风笛,绅士：一个可以演奏风笛但选择不去的人。,1
营地墙上发现洞 警方调查,发现,洞,在裸体主义者的营地墙上发现了一个洞。警方正在调查此事。,0
孩子把肥皂洗干净了引热议,洗干净,肥皂,爸爸：哎呀，小乖乖！你洗了一上午，洗干净了些什么？ 儿子：爸爸，我把肥皂洗干净了。,1
医院惊魂：患者喊失腿，医生反称切臂,切断,手臂,一名男子在一次严重事故后在医院里被唤醒。他喊道，“医生，医生，我感觉不到我的腿！”医生回答说：“我知道你不能 - 我已经切断了你的手臂！”,1
拒绝接受他人意见,拒绝,意见,我尊重你的意见。只是不想听到它！,0
邮票上贴照片助邮递员寻址,放置,邮票,他们应该把邮票的照片放在邮票上，以便邮递员可以在他们的路线上找他们。,0
邻居代选牛奶归属引热议,选择,奶牛,代表民主：你有两头奶牛。你的邻居选择一个人来告诉你谁得到了牛奶。,1
学生家访引笑料：怕老师下毒,斟,茶,班主任家访，只有二货同学和他爷爷在家， 斟茶时，二货同学先斟自己，他爷爷说应该先斟老师的， 那二货来了一句：“我怕老师说我下毒！”,1
法官庭审中被告引用名言反驳盗窃指控,拿了,幸福,法官对被告说：你不但偷钱，还拿了表，戒指和珍珠。 被告说：是的，法官先生，人们不是常说‘光有钱并不会得到幸福吗？,1
男人面孔各异却本质相同,区分,面孔,男人都是一样的 - 他们只是有不同的面孔，所以你可以区分他们。,1
男女安全感偏好大反转,吸引,男人,女人喜欢有安全感的男人；男人却往往被缺乏安全感的女人吸引。,1
朋友喝香槟，假朋友遭痛苦,喝,痛苦,为我真正的朋友喝香槟，为我的假朋友带来真正的痛苦！,1
体重不能超冰箱,超过,冰箱,你的体重不应超过你的冰箱。,1
90%罪行在家附近引发公众感动,感动,罪行,当她听说90％的罪行都在家附近时，她感动了。,0
餐厅设吸烟区被调侃似游泳池撒尿,制作,吸烟区,是不是在餐厅里制作吸烟区有点像在游泳池里撒尿？,1
瘙痒程度与能力成反比引热议,瘙痒,能力,瘙痒的严重程度与达到瘙痒的能力成反比。,1
字字珠玑与咬文嚼字调侃文字吃法,吃下,文字,字字珠玑对咬文嚼字说：连字你都能吃下去。热量很高还是口感很好？ 咬文嚼字对字字珠玑说：一般般啦，我只是看中字的美容养颜功能。这一点姐姐你比我更明白的啦。,1
食堂涨价学生饿成瘦马,涨价,瘦马,苦藤老树昏鸦， 食堂又在涨价， 同学饿成瘦马。 夕阳西下， 妈妈我要回家。,1
狂热者表达极端热情,狂热,者,我是一个绝对的，非常狂热的狂热者。,0
孔子孟子热议午睡与崩溃,曰,崩溃,孔子曰:中午不睡下午崩溃。孟子曰:孔子说的对。,1
办公室电脑开机慢引出奇葩建议,提前,开机,办公室里的电脑特慢。 某日有同事跟主任提议换机器，说：“现在用的机器开机都要半小时！” 主任说：“你不会提前半小时来啊？”,1
退休者难劝睡前孩子,说服,孩子,最难说服退休时间的人是睡前的孩子。,0
探讨解决方案与问题关系,研究,问题,您是在研究解决方案还是问题的一部分？,0
火锅店锅底骨头昨日重现,发现,骨头,吃清水烫时发现锅底大骨头跟昨天锅底的一模一样，问老板：你家锅底骨头咋长得都是一个模样！老板指着店牌没说话，我一看店牌：昨日重现火锅店。,1
全面代码审查完成,遍历,代码,我们已经遍历了每个系统中每个程序的每一行代码。,0
